{
  "version": "v1",
  "run_id": "20260307T085652Z_0743f96_throughput-http",
  "suite": "throughput-http",
  "target_id": "spacetime-native-rs",
  "interval_s": 1,
  "points": [
    {
      "time": "2026-03-07T08:58:49.054003895Z",
      "rps": 1433.709629826354,
      "err": 0.0,
      "latency": {
        "avg": 0.6968225782905986,
        "p95": 1.0349119999999998,
        "p99": 1.2540965000000002,
        "p999": 1.4873205
      },
      "cpu": [
        4.985716256002585,
        6.7599004954099655,
        4.9303478474418325,
        4.601486548781395,
        4.883313429852326,
        4.922773813207944,
        5.930288724601269,
        4.892331068714459,
        4.933194508155187,
        4.801827475428581,
        4.866963808735211,
        6.736594036221504,
        4.888778321444988,
        4.967882094283898,
        4.909755552808444,
        4.980337547759215,
        4.905074755350749,
        4.8551025713483495,
        4.656752750277519,
        4.721579040090243,
        7.188905045390129,
        4.709352935353915,
        4.95695814738671,
        4.8909817437330885,
        4.8899602716167765,
        4.963433384895325,
        5.042865559458733,
        4.866033107042313,
        4.960145870844523,
        6.192613425354163
      ],
      "mem_mb": 11.625
    },
    {
      "time": "2026-03-07T09:01:43.645548082Z",
      "rps": 1508.116640761959,
      "err": 0.0,
      "latency": {
        "avg": 0.6624933563033677,
        "p95": 0.974195,
        "p99": 1.1154205,
        "p999": 1.366139
      },
      "cpu": [
        4.716667133073012,
        4.895281958083312,
        5.085172784825166,
        4.835356754561265,
        4.823194906115532,
        4.90543590982755,
        5.00827531516552,
        7.06030369301637,
        4.882203988730907,
        4.895989621678988,
        4.908554640909036,
        4.850803047418594,
        6.3446169172724085,
        4.709529447058837,
        4.7137724955876665,
        4.957154683768749,
        4.846053841213386,
        7.218594605724017,
        4.816956204672654,
        5.044021214048068,
        5.027436139682929,
        5.211017616093159,
        5.874472859005134,
        5.962825678288937,
        6.057754913965861,
        5.75233877201875,
        6.618034054835637,
        6.631576873362064,
        5.110043381651242,
        4.878997325897217
      ],
      "mem_mb": 11.4375
    },
    {
      "time": "2026-03-07T09:04:34.587497489Z",
      "rps": 1512.6987630274457,
      "err": 0.0,
      "latency": {
        "avg": 0.6604073863981903,
        "p95": 0.9524825,
        "p99": 1.097965,
        "p999": 1.3000859999999999
      },
      "cpu": [
        5.033741916219394,
        4.859810610612233,
        5.049897111952305,
        4.926293025414149,
        4.711876551310222,
        5.0025263875722885,
        6.960592528184255,
        5.018752795954545,
        5.200970026353995,
        5.009646145006021,
        4.853560119867325,
        5.064898292223613,
        4.691178301970164,
        4.920181937515736,
        5.033937518795331,
        4.81549197435379,
        6.249444151918094,
        4.89925913264354,
        5.064553861816724,
        4.804465517401695,
        6.692734517157078,
        4.837038879593213,
        4.86999998986721,
        4.901597986618678,
        5.069120608270168,
        6.593518892923991,
        4.861702052255471,
        5.309167362749577,
        4.896965121229489,
        5.014081637064616
      ],
      "mem_mb": 11.625
    },
    {
      "time": "2026-03-07T09:07:27.758815556Z",
      "rps": 1504.3223965752156,
      "err": 0.0,
      "latency": {
        "avg": 0.664109811024592,
        "p95": 0.9675370000000001,
        "p99": 1.131888,
        "p999": 1.3286205
      },
      "cpu": [
        4.8016835153102875,
        4.839521586894989,
        4.941127980748813,
        5.04293604940176,
        6.566018248597781,
        4.849432652195294,
        4.940502447386582,
        4.849112443625927,
        5.240301775435607,
        4.950309100250403,
        4.9856985832254095,
        4.823453615109126,
        5.370404176414013,
        4.870829823116462,
        6.233567893505096,
        5.20797473937273,
        4.846958401302497,
        4.829962852100532,
        4.828185049196084,
        4.963641626139482,
        4.790751437346141,
        4.945422934989135,
        5.132094134887059,
        6.345748061935107,
        5.178218272825082,
        4.956503977378209,
        5.077807212869327,
        6.117130478223165,
        5.4935149401426315,
        5.2538118014733
      ],
      "mem_mb": 11.4375
    },
    {
      "time": "2026-03-07T09:10:20.837009402Z",
      "rps": 1517.4005894035845,
      "err": 0.0,
      "latency": {
        "avg": 0.6583374671816202,
        "p95": 0.9764120000000001,
        "p99": 1.1553205,
        "p999": 1.3623205
      },
      "cpu": [
        4.559146595497926,
        6.8034681876500445,
        4.949245775739352,
        4.913690224289894,
        5.059552356600761,
        4.967554745574792,
        4.944461867213249,
        4.744364579518636,
        4.901290158430736,
        4.888925276696682,
        6.637195433179538,
        4.86064297457536,
        5.029702909290791,
        5.118827871978283,
        4.8471744532386465,
        5.118918269872665,
        4.7199791893363,
        4.768216113249461,
        5.645632145305474,
        4.898109833399455,
        7.436829586823781,
        5.054105306665103,
        5.011551300684611,
        4.831963124374549,
        4.85398019105196,
        4.8120137850443525,
        5.00532445559899,
        5.10521616290013,
        4.898648130397002,
        6.573409214615822
      ],
      "mem_mb": 11.625
    }
  ]
}