{
  "version": "v1",
  "run_id": "20260306T095245Z_749baad_throughput-http",
  "suite": "throughput-http",
  "target_id": "drizzle-rs-sqlite",
  "interval_s": 1,
  "points": [
    {
      "time": "2026-03-06T09:53:16.872954Z",
      "rps": 554.4850281966222,
      "err": 0.0,
      "latency": {
        "avg": 1.8026460633468102,
        "p95": 4.5264500000000005,
        "p99": 4.69315,
        "p999": 4.962149999999999
      },
      "cpu": [
        12.126550674438477,
        11.53107770284017,
        11.355242411295572,
        11.465235710144043,
        14.020711739857992,
        17.446460564931233,
        14.480360666910807,
        13.856084505716959,
        14.831075668334961,
        11.034854888916016,
        12.460875829060873,
        10.648018836975098,
        12.37142022450765,
        12.211535930633545,
        12.038838068644205,
        11.278312683105469,
        10.91783587137858,
        11.067020734151205,
        15.459829807281494,
        11.48734188079834,
        11.766595204671225,
        11.361213684082031,
        10.707199414571127,
        11.02297846476237,
        11.332480112711588,
        10.507016817728678,
        11.48501714070638,
        12.720550696055094,
        14.58173656463623,
        11.459510803222656
      ]
    }
  ]
}